<?xml version="1.0" encoding="UTF-8"?>
<asseguranca_cotxe
xmlns="http://www.iessonferrer.net/Ramon"
xmlns:xsi="http://www.w3.org/2001/XMLSchema-instance"
xsi:schemaLocation="http://www.iessonferrer.net/Ramon ExamenLM.xsd">
  <asseguranca id="a1" denominacio="AXA AutoFlexible">
          <asseguradora>AXA</asseguradora>
          <geocobertura>Europea</geocobertura>
          <cobrament moneda="Euro" permetMensual="Si">
              <financament>12mesos</financament>
              <mensualitat>8.41</mensualitat>
              <mensualitativa>9.91</mensualitativa>
              <anual>123</anual>
          </cobrament>
          <promocions aplicable="tothom">
              <descompteonline>10</descompteonline>
          </promocions>
    </asseguranca>
    
    <asseguranca id="a2" denominacio="Fenix Seguros PolizaPlus">
          <asseguradora>FenixDirecto</asseguradora>
          <geocobertura>Europea</geocobertura>
          <cobrament moneda="Euro" permetMensual="Si">
              <financament>12mesos</financament>
              <mensualitat>12.43</mensualitat>
              <mensualitativa>14.67</mensualitativa>
              <anual>182</anual>
          </cobrament>
          <promocions aplicable="tothom">
              <descompteedat edat="35">20</descompteedat>
          </promocions>
    </asseguranca>
    
    <asseguranca id="a3" denominacio="Balumba SinAsistencia">
          <asseguradora>Balumba.es</asseguradora>
          <geocobertura>Espanyola</geocobertura>
          <cobrament moneda="Euro" permetMensual="No">
              <financament>1any</financament>
              <anual>192</anual>
          </cobrament>
          <promocions aplicable="nouClient"></promocions>
    </asseguranca>
    
    <asseguranca id="a4" denominacio="FenixDirecto + PackSeguridad">
          <asseguradora>FenixDirecto</asseguradora>
          <geocobertura>Europea</geocobertura>
          <cobrament moneda="Euro" permetMensual="Si">
              <financament>12mesos</financament>
              <mensualitat>13.25</mensualitat>
              <mensualitativa>15.64</mensualitativa>
              <anual>194</anual>
          </cobrament>
          <promocions aplicable="tothom">
              <descompteonline>15</descompteonline>
          </promocions>
    </asseguranca>
    
    <asseguranca id="a5" denominacio="Pelayo Tarifa Nocturna">
          <asseguradora>Pelayo</asseguradora>
          <geocobertura>Espanyola</geocobertura>
          <cobrament moneda="Euro" permetMensual="No">
              <financament>1any</financament>
              <anual>212</anual>
          </cobrament>
          <promocions aplicable="nouClient">
              <descompteonline>10</descompteonline>
              <descompteedat edat="40">25</descompteedat>
          </promocions>
    </asseguranca>
    
    <asseguranca id="a6" denominacio="Catalana Occidente">
          <asseguradora>Catalana Occidente</asseguradora>
          <geocobertura>Espanyola</geocobertura>
          <cobrament moneda="Euro" permetMensual="Si">
              <financament>6mesos</financament>
              <mensualitat>58.63</mensualitat>
              <mensualitativa>69.53</mensualitativa>
              <anual>429</anual>
          </cobrament>
          <promocions aplicable="nouClient"></promocions>
    </asseguranca>
</asseguranca_cotxe>
